subjectGroup,GMT_timestamp,local_timestamp,mindsCode,link,calibration,id,age,sex,education,handedness,nationality,completionCode,,,,,,,,,,,,,,,,,,,,,,,,,,,Subject.Rép absolue,Robot,Rép soumise,Bonne rép,Success absolu,Success w robot,Nb success absolus,Nb success w robots,BDM,Réception,Paiement,Trials randomly picked,N° veracity,N° WTP,News to send,,,,,
2,2022-01-10_09:43:24,2022-01-10_10:43:24,M063845,https://www.testable.org/experiment/4303/294929/start?participant=M063845,0.81,THOMAS RISE,24,male,Bachelor degree,right-handed,France,idL8JQAp97VhgTxP,,,,,,,,,,,,,,,,,,,,,,,,,,,,,,,,,,,,,,,,,,,,,,
,,,,,,,,,,,,,,,,,,,,,,,,,,,,,,,,,,,,,,,,,,,,,,,,,,,,,,,,,,
rowNo,trialNo,type,title,fixation,ITI,trialText,trialTextPos,trialTextOptions,stim1,stimPos,button1,button2,if,then,label,responsePos,head,body,responseOptions,subjectGroup,random,randomBlock,responseRows,required,stimFormat,pageBreak,pageName,bgColor,textColor,stimPos_actual,ITI_ms,ITI_f,ITI_fDuration,timestamp,response,RT,correct,responseCode,,,,,,,,,,,,,,,,,,,,
13,Greenpeace,form,,,,,,,,,,,,,,,"<b><font size=""6""><center>Greenpeace</center></font></b>","<font size=""4""><p align=”justify”> Depuis sa création il y a une cinquantaine d’années, Greenpeace agit sur terre et en mer selon les principes de non-violence pour protéger l’environnement et promouvoir la paix. Aujourd’hui, nous restons fidèles à cette mission, ainsi qu'à notre totale indépendance financière et idéologique. <br/><br/> Changements climatiques, inégalités grandissantes, injustices sociales, migrations et conflits armés... Tous les grands défis de notre époque, auxquels nous devons répondre de toute urgence, sont intimement liés – tout comme les structures de pouvoir qui en sont à l’origine et les mentalités qui s’en accommodent. C’est pourquoi il est nécessaire de les transformer conjointement. <br/><br/> Greenpeace est présente dans 55 pays, sur tous les continents et tous les océans grâce à ses 28 bureaux nationaux et régionaux et ses trois bateaux. Elle compte plus de trois millions d'adhérent·es et plus de 36 000 bénévoles à travers le monde. Nous plaçons le pouvoir citoyen au cœur de nos campagnes en donnant une résonance au travail de toutes celles et tous ceux qui partagent notre vision, nos espoirs et notre conviction qu’il faut des transformations profondes de nos sociétés.</p></font>",1_7_1;4,,1,,"<b>A quel point cette organisation vous est-elle familière ? </b><br/>(1 = pas du tout familière)<br/>(7 = très familière)<br/><br/>; <b>A quel point trouvez-vous que les valeurs de cette organisation sont proches des vôtres ? </b><br/>(1 = pas du tout proches)<br/>(7 = très proches)<br/><br/> ; <b>A quel point appréciez-vous cette organisation ? </b><br/>(1 = je n'apprécie pas du tout)<br/>(7 = j'apprécie fortement)<br/><br/> ; <b>A quel point cette organisation vous est-elle, selon vous, familière à vos proches ? </b><br/>(1 = pas du tout familière)<br/>(7 = très familière)<br/><br/>; <b>A quel point vos proches trouveraient-ils, selon vous, que les valeurs de cette organisation sont proches des leurs ? </b><br/>(1 = pas du tout proches)<br/>(7 = très proches)<br/><br/> ; <b>A quel point vos proches apprécieraient-ils, selon vous, cette organisation ?</b><br/>(1 = ils n'apprécieraient pas du tout)<br/>(7 = ils apprécieraient fortement)",,.png,1,<center>Veuillez évaluer l'organisation suivante</center>,,,,0,0,0,225745,6_6_6_7_6_6,59409,0,6_6_6_7_6_6,,,,,,,,,,,,,N° Random draw,N° Random draw,N° Random draw,N° Random draw,N° Random draw,N° Random draw,N° Random draw,N° Random draw
18,Fondation Robert Schuman,form,,,,,,,,,,,,,,,"<b><font size=""6""><center>Fondation Robert Schuman</center></font></b>","<font size=""4""><p align=”justify”>Créée en 1991 et reconnue d'utilité publique, la Fondation Robert Schuman œuvre en faveur de la construction européenne. Centre de recherche de référence, la Fondation développe des études sur l'Union européenne et ses politiques et en promeut le contenu en France, en Europe et à l'étranger. <br/><br/>La Fondation est un lieu de travail en réseau ouvert et multinational. Elle s'est donnée pour principale mission de garder vivants l'esprit et l'inspiration d'un des ""Pères de l'Europe"", Robert Schuman et de promouvoir les valeurs et les idéaux européens à l'intérieur comme hors des frontières de l'Union. <br/><br/>La Fondation produit de nombreuses études sur les politiques européennes qui constituent une précieuse source d'informations pour tous ceux qui veulent comprendre les questions et enjeux européens. Son indépendance lui permet de traiter de tous les sujets d'actualité de manière approfondie et objective. Ses études et analyses apportent aux décideurs européens des informations, arguments et éléments de réflexion appréciés pour leur utilité et leur qualité scientifique. Elle multiplie les initiatives sur le terrain pour faire progresser le modèle démocratique européen.</p></font>",1_7_1;4,,1,,"<b>A quel point cette organisation vous est-elle familière ? </b><br/>(1 = pas du tout familière)<br/>(7 = très familière)<br/><br/>; <b>A quel point trouvez-vous que les valeurs de cette organisation sont proches des vôtres ? </b><br/>(1 = pas du tout proches)<br/>(7 = très proches)<br/><br/> ; <b>A quel point appréciez-vous cette organisation ? </b><br/>(1 = je n'apprécie pas du tout)<br/>(7 = j'apprécie fortement)<br/><br/> ; <b>A quel point cette organisation vous est-elle, selon vous, familière à vos proches ? </b><br/>(1 = pas du tout familière)<br/>(7 = très familière)<br/><br/>; <b>A quel point vos proches trouveraient-ils, selon vous, que les valeurs de cette organisation sont proches des leurs ? </b><br/>(1 = pas du tout proches)<br/>(7 = très proches)<br/><br/> ; <b>A quel point vos proches apprécieraient-ils, selon vous, cette organisation ?</b><br/>(1 = ils n'apprécieraient pas du tout)<br/>(7 = ils apprécieraient fortement)",,.png,1,<center>Veuillez évaluer l'organisation suivante</center>,,,,0,0,0,285504,1_5_4_1_4_4,59125,0,1_5_4_1_4_4,,,,,,,,,,,,,31,12,46,33,7,41,12,11
12,La Manif Pour Tous,form,,,,,,,,,,,,,,,"<b><font size=""6""><center>La Manif Pour Tous</center></font></b>","<font size=""4""><p align=”justify”> La Manif Pour Tous défend le mariage et la filiation en cohérence avec la réalité sexuée de l’humanité, dont la conséquence est à la fois la différence et la complémentarité des sexes, incontournable pour concevoir un enfant et assumer la différence père-mère, paternité-maternité. Notre finalité est le respect de l’intérêt supérieur et des besoins élémentaires de l’enfant, aujourd’hui menacés par les réformes sociétales inspirées par l’idéologie du genre. <br/><br/>La Manif Pour Tous se situe dans une démarche pragmatique dont l’objectif est de favoriser le bien-être et l’avenir de l’enfant, de l’adulte et de la société dans son ensemble, ce qu’on appelle couramment l’intérêt général. Elle agit pour les générations présentes et à venir. <br/><br/> Enfin, La Manif Pour Tous rappelle que la famille est le carrefour de la différence des sexes et de la différence des générations. Seul ce contexte répond aux besoins essentiels de l’enfant pour venir au monde, connaître son identité personnelle, entrer peu à peu en relations avec les autres, s’insérer dans le groupe puis dans la société, contribuer à la paix sociale. </p></font>",1_7_1;4,,1,,"<b>A quel point cette organisation vous est-elle familière ? </b><br/>(1 = pas du tout familière)<br/>(7 = très familière)<br/><br/>; <b>A quel point trouvez-vous que les valeurs de cette organisation sont proches des vôtres ? </b><br/>(1 = pas du tout proches)<br/>(7 = très proches)<br/><br/> ; <b>A quel point appréciez-vous cette organisation ? </b><br/>(1 = je n'apprécie pas du tout)<br/>(7 = j'apprécie fortement)<br/><br/> ; <b>A quel point cette organisation vous est-elle, selon vous, familière à vos proches ? </b><br/>(1 = pas du tout familière)<br/>(7 = très familière)<br/><br/>; <b>A quel point vos proches trouveraient-ils, selon vous, que les valeurs de cette organisation sont proches des leurs ? </b><br/>(1 = pas du tout proches)<br/>(7 = très proches)<br/><br/> ; <b>A quel point vos proches apprécieraient-ils, selon vous, cette organisation ?</b><br/>(1 = ils n'apprécieraient pas du tout)<br/>(7 = ils apprécieraient fortement)",,.png,1,<center>Veuillez évaluer l'organisation suivante</center>,,,,0,,,342846,6_1_2_6_1_1,56658,0,6_1_2_6_1_1,,,,,,,26,28,,,,,,,,,,,,
16,Climato-realistes,form,,,,,,,,,,,,,,,"<b><font size=""6""><center>Climato-réalistes</center></font></b>","<font size=""4""><p align=”justify”>Apparu en France en 2015, le climatoréalisme voit dans le climat un objet de science et non d’idéologie. Les évolutions climatiques sont multiples et mal comprises, si bien que rien ne prouve que notre mode de vie causerait un « dérèglement climatique ». Le dire n’est pas de l’égoïsme, du déni ou de l’antiécologisme, mais du réalisme. Nous devons réfléchir à la meilleure manière d’utiliser nos ressources, et porter nos efforts là où ils sont vraiment utiles. <br/><br/> L’association des climato-réalistes a pour objet de promouvoir un débat ouvert et libre sur l’évolution du climat et les questions sociétales et environnementales qui s’y rapportent, en favorisant l’expression sous toutes ses formes d’avis rigoureux et argumentés. <br/><br/>L'association vise à sensibiliser le citoyen aux enjeux du climat et des politiques énergétiques menées au nom de la lutte contre le réchauffement climatique. L’association est apolitique et totalement libre dans l’expression de ses idées. Elle s’attache à diffuser une information fiable recueillie auprès de sources sérieuses.</p></font>",1_7_1;4,,1,,"<b>A quel point cette organisation vous est-elle familière ? </b><br/>(1 = pas du tout familière)<br/>(7 = très familière)<br/><br/>; <b>A quel point trouvez-vous que les valeurs de cette organisation sont proches des vôtres ? </b><br/>(1 = pas du tout proches)<br/>(7 = très proches)<br/><br/> ; <b>A quel point appréciez-vous cette organisation ? </b><br/>(1 = je n'apprécie pas du tout)<br/>(7 = j'apprécie fortement)<br/><br/> ; <b>A quel point cette organisation vous est-elle, selon vous, familière à vos proches ? </b><br/>(1 = pas du tout familière)<br/>(7 = très familière)<br/><br/>; <b>A quel point vos proches trouveraient-ils, selon vous, que les valeurs de cette organisation sont proches des leurs ? </b><br/>(1 = pas du tout proches)<br/>(7 = très proches)<br/><br/> ; <b>A quel point vos proches apprécieraient-ils, selon vous, cette organisation ?</b><br/>(1 = ils n'apprécieraient pas du tout)<br/>(7 = ils apprécieraient fortement)",,.png,1,<center>Veuillez évaluer l'organisation suivante</center>,,,,0,,,405751,2_5_4_1_5_6,62276,0,2_5_4_1_5_6,,,,,,,,,,,,,N° Random draw,N° Random draw,N° Random draw,N° Random draw,N° Random draw,N° Random draw,N° Random draw,N° Random draw
17,Mouvement Europeen France,form,,,,,,,,,,,,,,,"<b><font size=""6""><center>Mouvement Européen France</center></font></b>","<font size=""4""><p align=”justify”>Le Mouvement Européen – France se mobilise depuis 1950, à travers toutes les générations, pour faire vivre un débat public pluraliste sur l’Europe. Il déploie ses activités autour de la pédagogie, de l’organisation du débat entre les citoyens et de la formulation de propositions pour construire l’Europe. <br/><br/> Il rassemble des milliers de bénévoles réunis au sein de plus de 50 sections locales, une vingtaine d’organisations membres ainsi qu’un collège de personnalités qualifiées. Héritier de l’esprit des pères fondateurs de l’Europe, le Mouvement est le premier acteur de la société civile en France sur les enjeux européens. <br/><br/>Il se mobilise également à travers avec sa branche jeune, les Jeunes Européens – France, qui compte 26 groupes locaux répartis sur le territoire. Au niveau européen, le Mouvement Européen est également membre du Mouvement Européen – International, un réseau de 39 organisations qui font résonner notre engagement à travers le continent. Le Mouvement Européen-France est reconnu comme association d’intérêt général depuis le 22 juillet 2016 et est par ailleurs agréé « association éducative complémentaire de l’enseignement public ».</p></font>",1_7_1;4,,1,,"<b>A quel point cette organisation vous est-elle familière ? </b><br/>(1 = pas du tout familière)<br/>(7 = très familière)<br/><br/>; <b>A quel point trouvez-vous que les valeurs de cette organisation sont proches des vôtres ? </b><br/>(1 = pas du tout proches)<br/>(7 = très proches)<br/><br/> ; <b>A quel point appréciez-vous cette organisation ? </b><br/>(1 = je n'apprécie pas du tout)<br/>(7 = j'apprécie fortement)<br/><br/> ; <b>A quel point cette organisation vous est-elle, selon vous, familière à vos proches ? </b><br/>(1 = pas du tout familière)<br/>(7 = très familière)<br/><br/>; <b>A quel point vos proches trouveraient-ils, selon vous, que les valeurs de cette organisation sont proches des leurs ? </b><br/>(1 = pas du tout proches)<br/>(7 = très proches)<br/><br/> ; <b>A quel point vos proches apprécieraient-ils, selon vous, cette organisation ?</b><br/>(1 = ils n'apprécieraient pas du tout)<br/>(7 = ils apprécieraient fortement)",,.png,1,<center>Veuillez évaluer l'organisation suivante</center>,,,,0,,,470757,1_5_4_2_5_4,64376,0,1_5_4_2_5_4,,,,,,,,,,,,,10,9,28,37,29,48,5,26
20,Parti Libertarien,form,,,,,,,,,,,,,,,"<b><font size=""6""><center>Parti Libertarien</center></font></b>","<font size=""4""><p align=”justify”>Notre constat est le même que la majorité des Français : le poids de l’état et son périmètre d’action ne cessent d’augmenter, entravant toujours plus nos libertés, avec les résultats catastrophiques que tout le monde constate. <br/><br/>Nous sommes également face à une inflation législative extrêmement préoccupante, l’accumulation de normes, de réglementations et de lois rendent le système incompréhensible pour la majorité des Français et impraticable pour les entrepreneurs. Seuls les grands groupes et les multinationales profitent de cette complexité et peuvent s’étendre sans réelle concurrence. Ces réglementations paralysent toute initiative personnelle, bloquent l’ascenseur social et augmentent les inégalités. <br/><br/>Au-delà des conséquences dramatiques d’une telle intrusion de l’état dans la vie des individus, ce dernier, en voulant réguler chaque aspect de notre quotidien, va au-delà de ses prérogatives et viole notre droit fondamental à gérer notre vie comme bon nous semble. Nous sommes libertariens et nous considérons que c’est aux individus libres d’écrire leur histoire.</p></font>",1_7_1;4,,1,,"<b>A quel point cette organisation vous est-elle familière ? </b><br/>(1 = pas du tout familière)<br/>(7 = très familière)<br/><br/>; <b>A quel point trouvez-vous que les valeurs de cette organisation sont proches des vôtres ? </b><br/>(1 = pas du tout proches)<br/>(7 = très proches)<br/><br/> ; <b>A quel point appréciez-vous cette organisation ? </b><br/>(1 = je n'apprécie pas du tout)<br/>(7 = j'apprécie fortement)<br/><br/> ; <b>A quel point cette organisation vous est-elle, selon vous, familière à vos proches ? </b><br/>(1 = pas du tout familière)<br/>(7 = très familière)<br/><br/>; <b>A quel point vos proches trouveraient-ils, selon vous, que les valeurs de cette organisation sont proches des leurs ? </b><br/>(1 = pas du tout proches)<br/>(7 = très proches)<br/><br/> ; <b>A quel point vos proches apprécieraient-ils, selon vous, cette organisation ?</b><br/>(1 = ils n'apprécieraient pas du tout)<br/>(7 = ils apprécieraient fortement)",,.png,1,<center>Veuillez évaluer l'organisation suivante</center>,,,,0,,,528435,6_4_4_7_3_4,57045,0,6_4_4_7_3_4,,,,,,,,,,,,Compteur,7,8,,,,,,
9,SOS Mediterranee,form,,,,,,,,,,,,,,,"<b><font size=""6""><center>SOS Méditerranée</center></font></b>","<font size=""4""><p align=”justify”>SOS Méditerranée est une association civile européenne de sauvetage en mer, indépendante de tout parti politique et de toute confession, créée en 2015 et constituée de citoyens mobilisés face à l’urgence humanitaire en Méditerranée. SOS Méditerranée se fonde sur le respect de l’homme et de sa dignité, quelle que soit sa nationalité, son origine, son appartenance sociale, religieuse, politique ou ethnique. <br/><br/> L'association a vocation à porter assistance à toute personne en détresse sur mer se trouvant dans le périmètre de son action, sans aucune discrimination. Les personnes concernées sont des hommes, femmes ou enfants, migrants ou réfugiés, se retrouvant en danger de mort lors de la traversée de la Méditerranée. L'association vise également à assurer la protection des rescapés jusqu’à leur arrivée dans un port sûr et à témoigner de la situation en Méditerranée centrale. <br/><br/>L'association est financée par des dons privés et des subventions publiques. Les fonds collectés sont alloués à la location du bateau, aux frais quotidiens d’entretien et de sauvetage.</p></font>",1_7_1;4,,1,,"<b>A quel point cette organisation vous est-elle familière ? </b><br/>(1 = pas du tout familière)<br/>(7 = très familière)<br/><br/>; <b>A quel point trouvez-vous que les valeurs de cette organisation sont proches des vôtres ? </b><br/>(1 = pas du tout proches)<br/>(7 = très proches)<br/><br/> ; <b>A quel point appréciez-vous cette organisation ? </b><br/>(1 = je n'apprécie pas du tout)<br/>(7 = j'apprécie fortement)<br/><br/> ; <b>A quel point cette organisation vous est-elle, selon vous, familière à vos proches ? </b><br/>(1 = pas du tout familière)<br/>(7 = très familière)<br/><br/>; <b>A quel point vos proches trouveraient-ils, selon vous, que les valeurs de cette organisation sont proches des leurs ? </b><br/>(1 = pas du tout proches)<br/>(7 = très proches)<br/><br/> ; <b>A quel point vos proches apprécieraient-ils, selon vous, cette organisation ?</b><br/>(1 = ils n'apprécieraient pas du tout)<br/>(7 = ils apprécieraient fortement)",,.png,1,<center>Veuillez évaluer l'organisation suivante</center>,,,,0,,,568334,7_7_7_7_7_7,39260,0,7_7_7_7_7_7,,,,,,,,,,,,,Nber veracity trials to reward,Sum of payment,,,,,,
10,FEMEN,form,,,,,,,,,,,,,,,"<b><font size=""6""><center>FEMEN</center></font></b>","<font size=""4""><p align=”justify”>FEMEN est un mouvement international d'activistes politiques féministes aux torses nus, peints de slogans, et aux têtes couronnées de fleurs. Nos slogans sont courts et percutants, nos poitrines sont nos étendards. De la nécessité militante naît l'accomplissement d'actions puissantes et provocantes mais toujours non-violentes. Le mouvement est né en 2008 à Kiev en Ukraine. Dès 2010, les activistes se politisent et utilisent leur poitrine comme support de leurs revendications. <br/><br/>Avec nos actions provocantes et retentissantes, nous ciblons les multiples manifestations de l’ordre patriarcal : dictatures, industrie du sexe et religions. Nous sommes une revanche féminine contre la culture patriarcale sclérosée. Nous sommes une expression de la liberté et du pluralisme. <br/><br/> Notre ambition est de changer les mentalités et l’image publique des femmes en exposant notre force, notre courage et nos convictions. C’est en développant notre action politique que nous parviendrons à changer notre réalité même la plus intime. </p></font>",1_7_1;4,,1,,"<b>A quel point cette organisation vous est-elle familière ? </b><br/>(1 = pas du tout familière)<br/>(7 = très familière)<br/><br/>; <b>A quel point trouvez-vous que les valeurs de cette organisation sont proches des vôtres ? </b><br/>(1 = pas du tout proches)<br/>(7 = très proches)<br/><br/> ; <b>A quel point appréciez-vous cette organisation ? </b><br/>(1 = je n'apprécie pas du tout)<br/>(7 = j'apprécie fortement)<br/><br/> ; <b>A quel point cette organisation vous est-elle, selon vous, familière à vos proches ? </b><br/>(1 = pas du tout familière)<br/>(7 = très familière)<br/><br/>; <b>A quel point vos proches trouveraient-ils, selon vous, que les valeurs de cette organisation sont proches des leurs ? </b><br/>(1 = pas du tout proches)<br/>(7 = très proches)<br/><br/> ; <b>A quel point vos proches apprécieraient-ils, selon vous, cette organisation ?</b><br/>(1 = ils n'apprécieraient pas du tout)<br/>(7 = ils apprécieraient fortement)",,.png,1,<center>Veuillez évaluer l'organisation suivante</center>,,,,0,,,623822,7_5_3_7_5_4,54819,0,7_5_3_7_5_4,,,,,,,,,,,,,3,23,,,,,,
14,WWF,form,,,,,,,,,,,,,,,"<b><font size=""6""><center>WWF</center></font></b>","<font size=""4""><p align=”justify”>Le WWF est l’une des toutes premières organisations indépendantes de protection de l’environnement dans le monde. Le WWF œuvre pour mettre un frein à la dégradation de l’environnement naturel de la planète et construire un avenir où les humains vivent en harmonie avec la nature, en conservant la diversité biologique mondiale, en assurant une utilisation soutenable des ressources naturelles renouvelables, et en faisant la promotion de la réduction de la pollution et du gaspillage. <br/><br/> WWF France mène, depuis 1973, des actions concrètes pour sauvegarder les milieux naturels et leurs espèces, assurer la promotion de modes de vie durables, former les décideurs, accompagner les entreprises dans la réduction de leur empreinte écologique, et éduquer les jeunes publics. <br/><br/>Le WWF France, Fondation reconnue d'utilité publique, œuvre pour une planète vivante depuis Paris, Marseille, les Alpes, la Guyane et la Nouvelle-Calédonie. Adepte d'une action fondée sur le dialogue et le respect de l'autre, le WWF adopte une approche globaliste prenant en compte l’interdépendance entre l'état de la planète et le développement humain.</p></font>",1_7_1;4,,1,,"<b>A quel point cette organisation vous est-elle familière ? </b><br/>(1 = pas du tout familière)<br/>(7 = très familière)<br/><br/>; <b>A quel point trouvez-vous que les valeurs de cette organisation sont proches des vôtres ? </b><br/>(1 = pas du tout proches)<br/>(7 = très proches)<br/><br/> ; <b>A quel point appréciez-vous cette organisation ? </b><br/>(1 = je n'apprécie pas du tout)<br/>(7 = j'apprécie fortement)<br/><br/> ; <b>A quel point cette organisation vous est-elle, selon vous, familière à vos proches ? </b><br/>(1 = pas du tout familière)<br/>(7 = très familière)<br/><br/>; <b>A quel point vos proches trouveraient-ils, selon vous, que les valeurs de cette organisation sont proches des leurs ? </b><br/>(1 = pas du tout proches)<br/>(7 = très proches)<br/><br/> ; <b>A quel point vos proches apprécieraient-ils, selon vous, cette organisation ?</b><br/>(1 = ils n'apprécieraient pas du tout)<br/>(7 = ils apprécieraient fortement)",,.png,1,<center>Veuillez évaluer l'organisation suivante</center>,,,,0,,,676284,7_6_5_7_7_6,51820,0,7_6_5_7_7_6,,,,,,,,,,,,,50,200,,,,,,
